category,datetime,headline,id,image,related,source,summary,url,headline_sentiment,summary_sentiment
company,1708876800,"A $100,000 Dividend Snowball From A 5.5%-Yielding All-Weather Portfolio",126126620,https://static.seekingalpha.com/cdn/s3/uploads/getty_images/188027740/image_188027740.jpg?io=getty-c-w1536,MSFT,SeekingAlpha,Learn from renowned investors Charlie Munger and Ray Dalio on how to achieve long-term financial freedom through dividend growth investing. Read more here.,https://finnhub.io/api/news?id=b4ad1f891383851f901c86047f108c94da957e5bd119fc7131c4da7eacf35c3f,0.0,0.25
company,1708873380,2 Millionaire-Maker Artificial Intelligence (AI) Stocks,126121451,https://g.foolcdn.com/editorial/images/763721/msft-microsoft-stock-supercomputer-ai-artificial-intelligence.jpg,MSFT,Yahoo,These two millionaire-maker stocks are firing on all cylinders.,https://finnhub.io/api/news?id=f8ea768dfbb22413e0dffd6f9a6d66b7ce3dd071fba079bc837890aba549f532,-0.6,0.0
company,1708865132,"Yep, you are living in a Nvidia-led tech bubble",126120246,https://s.yimg.com/ny/api/res/1.2/UTXofzE9lC238jaH75bzTA--/YXBwaWQ9aGlnaGxhbmRlcjt3PTEyMDA7aD03OTg-/https://s.yimg.com/os/creatr-uploaded-images/2024-02/939caa80-d287-11ee-abe2-cd06a45256a5,MSFT,Yahoo,So many signs point to investors forgetting the basic principles of investing to chase hot AI stocks.,https://finnhub.io/api/news?id=caeb56b06d6aea8f970b329c28ed91f31df223c8b26425546a3ba0200bbec2ec,0.0,0.25
company,1708863706,13 Best Major Stocks to Buy Right Now,126119549,https://s.yimg.com/ny/api/res/1.2/GERdYYlDYdPUnfSoHbjEjQ--/YXBwaWQ9aGlnaGxhbmRlcjt3PTEyMDA7aD04MTE-/https://media.zenfs.com/en/insidermonkey.com/122bf82d8a60e4e2034afdddbd9c36d5,MSFT,Yahoo,"In this piece, we will take a look at the 13 best major stocks to buy right now. If you want to skip our coverage of the latest stock market news and some recent trends, then you can take a look at the 5 Best Major Stocks to Buy Right Now. The start of 2024 […]",https://finnhub.io/api/news?id=2ade8239233e11ccf65fb442e7dbe1bfca2bc58e73feb8cb84f8c415e80250bc,0.44940476190476186,0.3995535714285714
company,1708863207,Ken Fisher Portfolio: 12 Biggest Positions,126119907,https://s.yimg.com/ny/api/res/1.2/ZYefRkClLLXcl7c848BAMg--/YXBwaWQ9aGlnaGxhbmRlcjt3PTEyMDA7aD0xNjQz/https://media.zenfs.com/en/insidermonkey.com/7e0be664333815759bd72dc62b913ad8,MSFT,Yahoo,"In this piece, we will take a look at Ken Fisher’s latest investment portfolio and the 12 biggest positions. If you want to skip our overview of Fisher, his investment firm, and the broader U.S. stock market and macroeconomic environment, then you can take a look at Ken Fisher Portfolio: 5 Biggest Positions. Ken Fisher […]",https://finnhub.io/api/news?id=dd853fa279000b77e5d6286eb1c4fc82a8dd65bf02608902b2e3a70ed66652a9,0.0,0.15
company,1708861800,Is It Too Late to Buy Microsoft Stock?,126119298,https://g.foolcdn.com/editorial/images/766518/a-business-person-looking-at-charts-on-a-computer-with-light-reflecting-off-their-glasses.jpg,MSFT,Yahoo,The cloud computing and software titan has become the world's most valuable company. Are there more gains in store?,https://finnhub.io/api/news?id=e9d65b446de3f6be47c5c6d13f1e42132fa629396329a56022c10a4994154fc3,-0.3,0.5
company,1708861341,11 Best Revenue Growth Stocks to Invest In,126119190,https://s.yimg.com/ny/api/res/1.2/8sYkrGsYgaWsNLvnXNJB6g--/YXBwaWQ9aGlnaGxhbmRlcjt3PTEyMDA7aD04MDA-/https://media.zenfs.com/en/insidermonkey.com/e947ca70f6f895e24a70ed7306961d1b,MSFT,Yahoo,"In this article, we discuss the 11 best revenue growth stocks to invest in. If you want to read about some more such stocks, go directly to the 5 Best Revenue Growth Stocks to Invest in. As we navigate through 2024, the outlook for both the stock and bond markets experiences regular fluctuations, driven by […]",https://finnhub.io/api/news?id=4ae7e42325660502ac29159c7a25f3ea31bdd85b1a4b2da5681733663a7dd53a,1.0,0.43333333333333335
company,1708860794,11 Cheap AI Stocks to Buy in 2024,126119300,https://media.zenfs.com/en/insidermonkey.com/11d8e638f097acd6e9f2250a5ee41ee3,MSFT,Yahoo,"In this article, we discuss the 11 cheap AI stocks to buy in 2024. To skip the detailed analysis of the artificial intelligence industry, go directly to the 5 Cheap AI Stocks to Buy in 2024. The artificial intelligence (AI) revolution has hit the ground running since last year, and there seems to be no […]",https://finnhub.io/api/news?id=eb0ef48287c21999a0cedf8427dfb7f50718761a32924110e9b547981590eb8b,0.4,0.0142857142857143
company,1708859400,The Ultimate Artificial Intelligence (AI) Growth Stock to Buy With $500,126119301,https://g.foolcdn.com/editorial/images/765970/businessman_discussing_with_colleagues.jpg,MSFT,Yahoo,This AI-powered stock can generate healthy returns in the long run.,https://finnhub.io/api/news?id=f6f82e57290072797e5b4a3bc552eef244e1cc37e9d5369ecbd633c69ea1ac48,-0.3,0.225
company,1708858846,A Look At The Intrinsic Value Of Microsoft Corporation (NASDAQ:MSFT),126119302,https://media.zenfs.com/en/simply_wall_st__316/a5d5a89dd6ab73bc7694c99b9023ec2d,MSFT,Yahoo,Key Insights The projected fair value for Microsoft is US$445 based on 2 Stage Free Cash Flow to Equity Current share...,https://finnhub.io/api/news?id=6fd23ca02d94d0cb9e7d9345ce5fa174ed9b4016449f6bdf82fcfe197a9388b2,0.0,0.275
company,1708857600,Sector Standouts: 3 EV Stocks That Wall Street Loves,126122829,,MSFT,InvestorPlace,Looking for stock market analysis and research with proves results? Zacks.com offers in-depth financial research with over 30years of proven results.,https://finnhub.io/api/news?id=51419cb43598220a59b77e5f75dc097ad08e379140f002e5cfd1de20a18ad17e,0.5,0.13333333333333333
company,1708852320,6 Reasons to Avoid IBM (IBM) At This Moment,126121746,,MSFT,247WallSt,Looking for stock market analysis and research with proves results? Zacks.com offers in-depth financial research with over 30years of proven results.,https://finnhub.io/api/news?id=a7a2e26951c532aec386436ef0e47d1e28d8680dd8b31eedab941cbca44252e3,0.0,0.13333333333333333
company,1708846620,"Elon Musk Buys A New Windows PC, Fears Signing In Will Give Microsoft AI Access To His Computer: 'This Is Messed Up'",126144641,,MSFT,Benzinga,Looking for stock market analysis and research with proves results? Zacks.com offers in-depth financial research with over 30years of proven results.,https://finnhub.io/api/news?id=1799ae176d7caaa29c46f8830072750c6269d1ff3e1d27d072f193acd213662c,0.13636363636363635,0.13333333333333333
company,1708845960,It's Time To Look Beyond The Magnificent 7,126122318,,MSFT,TalkMarkets,Looking for stock market analysis and research with proves results? Zacks.com offers in-depth financial research with over 30years of proven results.,https://finnhub.io/api/news?id=75d8818c4e993724aa6ebabbcef160a6b41afc24afacd1cbf941656953057c95,1.0,0.13333333333333333
company,1708837320,The Rocket Has Taken Off for Nvidia. Where Does That Leave AMD Stock?,126121748,,MSFT,InvestorPlace,Looking for stock market analysis and research with proves results? Zacks.com offers in-depth financial research with over 30years of proven results.,https://finnhub.io/api/news?id=9acda03c60768274f4d5db025134c15f446855ebc21a159ffd4f095b3ef88be4,0.0,0.13333333333333333
company,1708834500,Semper Augustus Investments Group 2023 Letter To Clients,126117240,https://static.seekingalpha.com/cdn/s3/uploads/getty_images/1388369589/image_1388369589.jpg?io=getty-c-w1536,MSFT,SeekingAlpha,Semper Augustus Investments Group 2023 letter updates portfolio intrinsic value and contrast valuation and expectations for the future. Click here to read more.,https://finnhub.io/api/news?id=f66e0ca801dc974f6c4c15c24a83f57d9795e2087bc7a6d4b1274fab072a3a53,0.0,0.25
company,1708826400,You Spend Hours a Day in Your Browser. Now Make It Better.,126115725,https://s.yimg.com/ny/api/res/1.2/OQ3RQu4JjPwwxDbOiKac7w--/YXBwaWQ9aGlnaGxhbmRlcjt3PTEyMDA7aD02MDA-/https://media.zenfs.com/en/wsj.com/16241e492fc34dbdc3d5c4652014dfae,MSFT,Yahoo,Team Chrome or Team Safari? Don’t be afraid to rethink your browser of choice—plus add AI and other enhancements.,https://finnhub.io/api/news?id=c26b4e46c84dde0bb5dd56c7d86d3879763b0e49b5fc9dfb4bc8101c239621e1,0.5,-0.3625
company,1708801243,Amazon joins 29 other 'blue chip' companies in the Dow Jones Industrial Average,126132163,https://s.yimg.com/ny/api/res/1.2/vVPAZkObu8JpT5U_w9yKTA--/YXBwaWQ9aGlnaGxhbmRlcjt3PTEyMDA7aD03NTE-/https://media.zenfs.com/en/ap_finance_articles_694/4f1f82b733b889398b636b1874cd9c11,MSFT,Yahoo,"Amazon.com Inc. is joining the ranks of one of Wall Street's oldest and most exclusive stock indexes: The Dow Jones Industrial Average.  The e-commerce pioneer will officially take its position among the 30-company Dow before the open of trading Monday, replacing drugstore operator Walgreens Boots Alliance.  S&P Dow Jones Indices opened the door to Amazon's inclusion in the Dow and Walgreens' exit to rebalance the index in light of a 3-for-1 stock split by another Dow company, Walmart.",https://finnhub.io/api/news?id=0a444de9841f077d25f88f6b13dbd09b5e52a64c7f5a43d92901a8e56e91e7a3,-0.09166666666666667,0.1875
company,1708797840,Will Nvidia Be Worth More Than Microsoft by 2025?,126109814,https://g.foolcdn.com/editorial/images/766539/financial-analyst-working-on-computer-with-multi-monitor-workstation-with-real-time-stocks.jpg,MSFT,Yahoo,The world's most valuable chipmaker just keeps growing.,https://finnhub.io/api/news?id=46b24b6e3c5435936798a4d85e29978aa3c7565b478a243427d5c801522821ed,0.4,0.5
company,1708794060,Will CrowdStrike Be a Trillion-Dollar Stock by 2040?,126104647,https://g.foolcdn.com/editorial/images/766365/digital-padlock-security.jpg,MSFT,Yahoo,The cloud-based cybersecurity company still has a bright future.,https://finnhub.io/api/news?id=5ccb4dfa2bcce6254e79a6717c5a311e12982433d55bc60705e323f83d38823e,0.0,0.35000000000000003
company,1708789500,Will Palantir Technologies Be a Trillion-Dollar Stock by 2035?,126103625,https://g.foolcdn.com/editorial/images/763719/finance-stock-chart-pltr-palantir-technologies.jpg,MSFT,Yahoo,Does Palantir have what it takes to make it into the elite $1 trillion club?,https://finnhub.io/api/news?id=13356e9c99b978b9e3688050b28b5c2a6d0224ba0ba9776d0c87cfd44c693dab,0.0,0.0
company,1708786800,"Niklaus Wirth, Who Inspired a Generation of Computer Programmers, Dies at 89",126103628,https://media.zenfs.com/en/wsj.com/7b2c285183be07ca3c4e8242b25a59a8,MSFT,Yahoo,"Alan Kay, the famed computer scientist, says he didn’t really know what the term “computer science” meant in 1966, when he read a lengthy description of a programming language written by a Swiss computer scientist named  Niklaus Wirth.  Wirth wrote so clearly, Kay says, that not only could he understand what he was reading, but he felt he could even argue with it.  A decade later, Kay was at the famed Xerox PARC—where he helped work on what became the Xerox Alto, a computer that inspired both  Apple  Mac and  Microsoft  Windows.",https://finnhub.io/api/news?id=537df72289359c6fc240c3e82c226451810dc7e93f832070cebf7ec341347057,0.0,0.075
company,1708786800,Better AI Stock: Microsoft vs. IBM,126103627,https://g.foolcdn.com/editorial/images/765272/artificial_intelligence_robot_looking_at_equations_gettyimages-966248982-1200x772-f9fd0c6.jpg,MSFT,Yahoo,These veteran tech giants are battling for a share of the $306 billion AI market.,https://finnhub.io/api/news?id=200ade8ff856aa1e1ad1ab00f74811779a2549a05cc24712aeaaeb375793a75b,0.5,0.0
company,1708785300,Is Now the Time to Buy DocuSign Stock?,126103631,https://g.foolcdn.com/editorial/images/766037/woman_using_tablet_while_in_store_gettyimages-1355856095.jpg,MSFT,Yahoo,Shares of the digital document company have been on a rollercoaster this year.,https://finnhub.io/api/news?id=9672e962da48fd1b0ebb00f34e72a94ce771d05110d2d7f7cb41ab48dccd074a,0.0,0.0
company,1708785002,"The best, worst positioned Mag 7 stocks coming off earnings",126103634,https://s.yimg.com/ny/api/res/1.2/Jebu2FsKcKBPQYHe7T090w--/YXBwaWQ9aGlnaGxhbmRlcjt3PTEyMDA7aD02NzU-/https://s.yimg.com/os/creatr-uploaded-images/2024-02/3038d670-d297-11ee-9ffb-f6509f057156,MSFT,Yahoo,"While semiconductor giant Nvidia (NVDA) incited a broad-based market rally following its fourth-quarter earnings, which Magnificent Seven component stocks are the best positioned and the worst positioned coming off of earnings season? Laffer Tengler Investments CEO and CIO Nancy Tengler and Steven Glass, Pella Funds Management Managing Director and Investment Analyst, make the case for their preferred tech companies. ""Clearly Nvidia is the winner, and will continue to win, I believe,"" Tengler states. ""But Amazon (AMZN) has yet to recast its highs and it's a company that has done improved efficiency, growing the advertising business, cloud came in better than expected."" Apple (AAPL) is ""obviously... depending on services now. They are doing very well in services, but they had to justify that market cap. They don't seem to have a large pipeline of new products coming through,"" Glass explains. ""It's just not growing and it does not justify its valuation given its growth profile."" For more expert insight and the latest market action, click here to watch this full episode of Yahoo Finance Live. Editor's note: This article was written by Luke Carberry Mogan.",https://finnhub.io/api/news?id=464dc94dd5642d98c9d9bc8253acf29543226cdc05cf9e182dd648ac164719ec,0.0,0.24650072150072155
company,1708780800,"Intel Foundry Wins ""Magnificent Seven"" Customer as Backlog Rockets Past $15 Billion",126102651,https://g.foolcdn.com/editorial/images/766611/intel-cube-statue-with-intel-logo_intel.jpg,MSFT,Yahoo,Microsoft will use Intel's manufacturing services for a next-generation chip.,https://finnhub.io/api/news?id=6260cce3fe2f6684adff744d033882031877811ab6bd17c880db97d0745f808c,0.35000000000000003,0.0
company,1708780200,History Says the Nasdaq Could Soar in 2024: 1 Artificial Intelligence (AI) Stock to Buy Hand Over Fist Before It Does,126103640,https://g.foolcdn.com/editorial/images/765854/green-stocks-up-bull-market.jpg,MSFT,Yahoo,Amazon is quietly making some disruptive moves in artificial intelligence that could meaningfully impact its core businesses.,https://finnhub.io/api/news?id=f0b9b0e96f8ac2f2425f4257b3dad33eb875c94e04ec2ac5206d220325b615ac,-0.6,-0.033333333333333326
company,1708778040,Wall Street Favorites: 7 Tech Stocks With Strong Buy Ratings for February 2024,126108341,,MSFT,InvestorPlace,Looking for stock market analysis and research with proves results? Zacks.com offers in-depth financial research with over 30years of proven results.,https://finnhub.io/api/news?id=d562e999c13abd55739ca56da72799b05446f9a061a153e256d8cfd57e6a8c8d,0.43333333333333335,0.13333333333333333
company,1708777200,Will Super Micro Computer Be Worth More Than Microsoft by 2050?,126103642,https://g.foolcdn.com/editorial/images/766167/woman-server-room.jpg,MSFT,Yahoo,Could the AI server maker become the next multi-trillion-dollar tech stock?,https://finnhub.io/api/news?id=8dd24f05edccb5b31e6f081abe20a434e03e95df350e3f0e5d2c7abfb62d42c2,0.37777777777777777,0.0
company,1708776180,3 Millionaire-Maker Metaverse Stocks to Buy in February 2024,126107010,,MSFT,InvestorPlace,Looking for stock market analysis and research with proves results? Zacks.com offers in-depth financial research with over 30years of proven results.,https://finnhub.io/api/news?id=acce260c9cacae0f20a4143257fa764d9a3f8ee7b5fe32264b7a54c2ed6be600,0.0,0.13333333333333333
company,1708775700,Billionaire Investor David Tepper Has 46% of His Portfolio Invested in 5 Brilliant Artificial Intelligence (AI) Growth Stocks -- but Made Some Big Changes During the Quarter,126101068,https://g.foolcdn.com/editorial/images/766075/a-closeup-of-a-person-reviewing-graphs-across-multiple-large-computer-monitors.jpg,MSFT,Yahoo,The fund manager has decreased the value of some of his biggest holdings by as much as 16%.,https://finnhub.io/api/news?id=c92cd8c82c527db055eb95e045baebdd2e2f9a873ccd75c53d677a28e8979615,0.10000000000000002,-0.1
company,1708766040,"Which ""Magnificent Seven"" Stock Is Poised for the Most Spectacular Growth? Here's the Hands-Down Winner.",126100447,https://g.foolcdn.com/editorial/images/766488/ai-icons-hand.jpg,MSFT,Yahoo,"This stock is arguably the most magnificent member of the ""Magnificent Seven.""",https://finnhub.io/api/news?id=5da92c4652fcaca3f65800e256ec2e20cfd98c54785dc8b6c1b3ac834333f75c,0.7000000000000001,0.8333333333333334
company,1708762740,Investing in the Next Wave of Explosive AI Growth,126103393,,MSFT,InvestorPlace,Looking for stock market analysis and research with proves results? Zacks.com offers in-depth financial research with over 30years of proven results.,https://finnhub.io/api/news?id=84a0927cfdce6d9e4e3e3f399175cf0415dc6c5c18eb6a1d63d2ea1cea5969fa,0.0,0.13333333333333333
company,1708755359,Microsoft Will Be One Of The Biggest Beneficiaries Of Artificial Intelligence,126100465,https://media.gettyimages.com/id/1246495638/de/foto/this-picture-taken-on-january-23-2023-in-toulouse-southwestern-france-shows-screens-displaying.jpg?b=1&s=594x594&w=0&k=20&c=ejfAgmHmBxWQKTSrtwa-orpHuTOmXhQYlTPfu5tpKow=,MSFT,SeekingAlpha,Microsoft is uniquely positioned to capitalize on the trends of the future and combine them with its own products. Click here to read more about MSFT.,https://finnhub.io/api/news?id=43bb236313cd3d3fbb55d28c8cf3c083d9edb40879980f11e19619ff4cd97ac7,-0.6,0.36875
company,1708754520,Apple may position the next iPhone as an 'AI' phone. What could that look like?,126103394,,MSFT,Seeking Alpha,Looking for stock market analysis and research with proves results? Zacks.com offers in-depth financial research with over 30years of proven results.,https://finnhub.io/api/news?id=88c35cc801e749339262de94bf33876185a7c4812c517eb8fce20e4c07eb2351,0.0,0.13333333333333333
company,1708750800,Nvidia is the ‘Magnificent One’ now — but these rivals are closing in,126103396,,MSFT,MarketWatch,Looking for stock market analysis and research with proves results? Zacks.com offers in-depth financial research with over 30years of proven results.,https://finnhub.io/api/news?id=962b49ce7b81e175a58825cbaa34feba38b2b725683d1d80f9142e2ab5a9e6ca,1.0,0.13333333333333333
company,1708749420,Is Salesforce Stock A Buy Ahead Of Q4 Earnings As Tech Stocks Soar?,126103397,,MSFT,TalkMarkets,Looking for stock market analysis and research with proves results? Zacks.com offers in-depth financial research with over 30years of proven results.,https://finnhub.io/api/news?id=f42efe8dbb0380fe970faa9e68c814cc3fa6580f34508acd3801abe93358e61b,0.0,0.13333333333333333
company,1708747440,Profitable Pivots: 3 Companies That Look Unrecognizable Thanks to AI,126122334,,MSFT,InvestorPlace,Looking for stock market analysis and research with proves results? Zacks.com offers in-depth financial research with over 30years of proven results.,https://finnhub.io/api/news?id=f1d19334e3b0dd81b1e7be350a5f57abf3255be58ae0366ad01863fd2c8708db,0.35,0.13333333333333333
company,1708741800,As Nvidia Flirts With $2 Trillion Valuation CEO Jensen Huang Reveals The Competitors That Keep Him 'Up At Night',126103398,,MSFT,Benzinga,Looking for stock market analysis and research with proves results? Zacks.com offers in-depth financial research with over 30years of proven results.,https://finnhub.io/api/news?id=40ae368e62a012e12d43061f1df3900b7703c4c6fc7f6f9e917c13a63c04fd4b,0.0,0.13333333333333333
company,1708738680,"Tesla Optimus Rival? Jeff Bezos, Microsoft And Nvidia Join Forces To Fund Humanoid Robot Startup",126103399,,MSFT,Benzinga,Looking for stock market analysis and research with proves results? Zacks.com offers in-depth financial research with over 30years of proven results.,https://finnhub.io/api/news?id=82d6638f73fed6512c48bb6d840fb4e8bdcf366169be4d2ea8936b614b7e322a,0.0,0.13333333333333333
company,1708727421,"Dow Jones Futures: Nvidia Eyes A Milestone, AMD Setting Up, But Stock Market Needs This",126090473,https://media.zenfs.com/en/ibd.com/7147c48c8897e84dc52aac4692b4ce8f,MSFT,Yahoo,"Stocks jumped to highs thanks to Nvidia, and The major indexes jumped to highs, but a longer pause would be welcome. A longer pause would be welcome. AMD and Microsoft are setting up.",https://finnhub.io/api/news?id=3369e260ebc1cf7ff179b73c57aedd7da90e6341750f1c59e5209d5e795d601d,0.0,0.465625
company,1708724191,1 Unstoppable Stock Set to Join Apple and Microsoft in the $2 Trillion Club in 2024,126095947,https://g.foolcdn.com/editorial/images/766523/nvidia-headquarters-with-nvidia-sign-in-front.png,MSFT,Yahoo,"This artificial intelligence (AI) giant only joined the $1 trillion club last year, but it could soon be worth more than $2 trillion.",https://finnhub.io/api/news?id=78acc994503f12d6f2d22eea37c842c40ec983c8e941585cded6931e75b0933d,0.0,0.03333333333333333
company,1708718913,"Bezos, Nvidia join OpenAI in funding humanoid robot startup, Bloomberg reports",126097963,https://s.yimg.com/cv/apiv2/social/images/yahoo_default_logo-1200x1200.png,MSFT,Yahoo,"Amazon.com founder Jeff Bezos, Nvidia and other big technology names are investing in a startup Figure AI that works in developing human-like robots, Bloomberg News reported on Friday, citing people with knowledge of the situation.  Figure AI, also backed by ChatGPT-maker OpenAI and Microsoft , is raising about $675 million in a funding round that carries a pre-money valuation of about $2 billion, according to the report.  Bezos had committed $100 million through his firm Explore Investments LLC and Microsoft is investing $95 million, while Nvidia and an Amazon-affiliated fund are each providing $50 million, the report added.",https://finnhub.io/api/news?id=d1a26fd908f05176e3d688b39a6a90ec0eb4d986588f555b06eb9fb6ec48fac0,0.0,-0.13125
company,1708710142,"Shaking Up The Mag 7: EPS Focuses On Earnings, Not Size",126090873,https://static.seekingalpha.com/cdn/s3/uploads/getty_images/1455774438/image_1455774438.jpg?io=getty-c-w1536,MSFT,SeekingAlpha,The WisdomTree U.S. Earnings 500 Fund ETF is earnings-focused and uses a rules-based approach to choose companies. Learn more about EPS ETF here.,https://finnhub.io/api/news?id=708267a6e48265ceee4119a4a1d69a44aa563063e6482cbb0f2dc8cdcbd44881,0.0,0.5
company,1708706640,Nvidia is the ‘Magnificent 1’ now — but these rivals are closing in,126089574,https://images.mktw.net/im-841967/social,MSFT,MarketWatch,"The competition is real, and it’s coming for Nvidia’s growth and stock price.",https://finnhub.io/api/news?id=5dde296008d216adfa88dad1866b16889a1fac5b4c5bf063283c614071ff7dad,1.0,0.2
company,1708704614,"BUG ETF: Let's Face It, Microsoft And Google Are Also Cybersecurity Plays",126088043,https://static.seekingalpha.com/cdn/s3/uploads/getty_images/1472032995/image_1472032995.jpg?io=getty-c-w1536,MSFT,SeekingAlpha,One of GlobalX Security ETF's top holdings has seen its stock tumble after providing weak guidance.Â Click here to learn more about the BUG ETF.,https://finnhub.io/api/news?id=9b7f18560b6a15c69abe7dfb578b272a0783deb5110f0a554740b3d2d6d5b94e,0.0,0.20833333333333334
company,1708701677,Which Magnificent 7 stock saw biggest post-earnings gains?,126082227,https://s.yimg.com/ny/api/res/1.2/lHwly_meegfpRXuZ3Hu_uw--/YXBwaWQ9aGlnaGxhbmRlcjt3PTEyMDA7aD02NzY-/https://s.yimg.com/os/creatr-uploaded-images/2024-02/2a551850-d25f-11ee-9ffc-ae4a98aa7a92,MSFT,Yahoo,"It's about time that all seven of the Magnificent 7 tech stocks have reported their fourth-quarter results. But of the crowd of seven, which stock is the best and the worst positioned for 2024? Yahoo Finance Senior Reporter Jared Blikre lays out the criteria, including single-day gains and earnings reactions, for the Magnificent Seven's stock outlook this year. For more expert insight and the latest market action, click here to watch this full episode of Yahoo Finance Live. Editor's note: This article was written by Luke Carberry Mogan.",https://finnhub.io/api/news?id=6de3640ef09c59dfbdd5425511b567149b48c98a41e5bf2bee307218e8282afa,1.0,0.3984848484848485
company,1708695900,A Once-in-a-Generation Investment Opportunity: 1 Artificial Intelligence (AI) Growth Stock to Buy Now and Hold Forever,126078275,https://g.foolcdn.com/editorial/images/766348/a-person-typing-on-a-laptop-with-various-ai-icons-displayed-bove.jpg,MSFT,Yahoo,AI could dramatically change how we interact with technology. One company has been at the forefront of this shift for decades.,https://finnhub.io/api/news?id=d876df1559b2842d7e535f54527a11faaf0bc96a725a2ccdcc7aebd9fce9c4cb,-0.6,0.0
company,1708692816,"Rating All ""Magnificent 7"" Stocks By Their Return Potential",126082001,https://media.gettyimages.com/id/176568108/photo/the-principle-cast-in-a-publicity-still-for-the-magnificent-seven-directed-by-john-sturges.jpg?b=1&s=594x594&w=0&k=20&c=YKaC1udP2CmCpBn7NwtkGCZ-QkoZfAO25XFy0mlc9Ws=,MSFT,SeekingAlpha,"The Magnificent Seven mega-cap companiesÂ now seems more like the Fantastic Four, experiencing significantly better returns. Explore more details here.",https://finnhub.io/api/news?id=38961151c44ee8aeb5264455d32b215ff40300d4942bec0fc69ef873390f838b,0.5,0.58
company,1708692120,Renewed AI Frenzy Leads Market To New High Overshadowing Negatives,126083006,,MSFT,Benzinga,Looking for stock market analysis and research with proves results? Zacks.com offers in-depth financial research with over 30years of proven results.,https://finnhub.io/api/news?id=a0b048559d8d3b01ae87594d7dc77fc0f322ab189581917b1e62d532742b5098,0.1481818181818182,0.13333333333333333
company,1708690440,"Jeff Bezos, Nvidia reportedly join others in backing startup building humanoid robot",126084941,,MSFT,Seeking Alpha,Looking for stock market analysis and research with proves results? Zacks.com offers in-depth financial research with over 30years of proven results.,https://finnhub.io/api/news?id=b0dc30c6a9602ec6c91d1d6b4acfc3bf20dfd443e068d29494a5ae02aba732d8,0.0,0.13333333333333333
