category,datetime,headline,id,image,related,source,summary,url,headline_sentiment,summary_sentiment
company,1708960224,Mistral AI releases new model to rival GPT-4 and its own chat assistant,126137428,"https://techcrunch.com/wp-content/uploads/2024/02/GettyImages-1630826367.jpg?resize=1200,800",MSFT,Yahoo,"Paris-based AI startup Mistral AI is gradually building an alternative to OpenAI and Anthropic as its latest announcement shows. The company is launching a new flagship large language model called Mistral Large. When it comes to reasoning capabilities, it is designed to rival other top-tier models, such as GPT-4 and Claude 2. In addition to Mistral Large, the startup is also launching its own alternative to ChatGPT with a new service called Le Chat. This chat assistant is currently available in",https://finnhub.io/api/news?id=5ca27691bce6395f4d0229cca8894a7797cb419822cb78653650dab44772809b,0.36818181818181817,0.22905844155844152
company,1708958611,"Google steps up Microsoft criticism, warns of rival's monopoly in cloud",126142582,,MSFT,Finnhub,"Alphabet's GoogleCloud on Monday ramped up its criticism of Microsoft's cloudcomputing practices, saying its rival is seeking a monopoly thatwould harm the development of emerging technologies such...",https://finnhub.io/api/news?id=e5ca7511a2c5177cb72294b82dbc62566edbf8c63f4d0542d1213ea905d16f94,0.0,0.0
company,1708957800,How Much Longer Will Apple Underperform the Nasdaq Composite?,126137429,https://g.foolcdn.com/editorial/images/765836/mature-man-frustrated-upset-sitting-in-front-of-computer-1200x800-5b2df79.jpg,MSFT,Yahoo,Apple isn't giving investors a lot to cheer about.,https://finnhub.io/api/news?id=080a317c4518ea603caa7f2058b1f23e1b2362b43126a16d9e3984ec7656d03f,0.2,0.0
company,1708956793,"Meet the Only ""Magnificent Seven"" Stock That Is Cheaper Than the S&P 500",126135780,https://g.foolcdn.com/editorial/images/766140/gettyimages-1270093714-1200x800-5b2df79.jpg,MSFT,Yahoo,"Alphabet stock has rallied, but it's still cheap.",https://finnhub.io/api/news?id=d6296b932427c2ea618da831a60c0ff3f22d456c99882a0e028b8a4ec83d96ce,0.5,0.4
company,1708956487,10 Stocks That Will Make You Rich In 2024,126134720,https://media.zenfs.com/en/insidermonkey.com/6e3ccd3cff24e4654c5a32f1398f5c65,MSFT,Yahoo,"In this article, we discuss the 10 stocks that will make you rich in 2024. To skip the detailed analysis of the recent events in the financial markets and expert outlook, go directly to the 5 Stocks That Will Make You Rich In 2024. So far, the Fed’s efforts have managed to contain the inflation […]",https://finnhub.io/api/news?id=8f8583ca861a3a980b40e46a25fe6a41cf5de71979e6bcf6958c33bba739e5d5,0.375,0.19285714285714287
company,1708956000,The 9-Month-Old AI Startup Challenging Silicon Valley’s Giants,126135782,https://s.yimg.com/ny/api/res/1.2/TlAH20K_NnZUlyymIrFBgA--/YXBwaWQ9aGlnaGxhbmRlcjt3PTEyMDA7aD02MDA-/https://media.zenfs.com/en/wsj.com/abe83d5fd7752911df63a85b0fdec367,MSFT,Yahoo,"Led by 31-year-old CEO Arthur Mensch, Paris-based Mistral believes AI systems can be built more efficiently—and much more cheaply.",https://finnhub.io/api/news?id=7e611ee3fa3ab124f2811cbbead716297ea8a79c9d0596c42cbe87bd8676d77d,0.5,0.4666666666666666
company,1708953090,Here’s Why Microsoft Corporation (MSFT) Rose in Q4,126134231,https://media.zenfs.com/en/insidermonkey.com/52d1772a91e0b074c5496ca25de5811e,MSFT,Yahoo,"RiverPark Advisors, an investment advisory firm and sponsor of the RiverPark family of mutual funds, released its “RiverPark Large Growth Fund” fourth quarter 2023 investor letter. A copy of the same can be downloaded here. The Russell 1000 Growth Index (RLG) returned 14.16% and the S&P 500 index returned 11.69% during the fourth quarter of 2023, […]",https://finnhub.io/api/news?id=3b9347baf7d47b4519594dcfcff72f8d9c65f018a8e72d6c47b16862098561b4,0.6,0.0028571428571428524
company,1708951680,Microsoft's Push Beyond ChatGPT - Strikes Deal With OpenAI's French Rival Mistral,126144578,,MSFT,Benzinga,Looking for stock market analysis and research with proves results? Zacks.com offers in-depth financial research with over 30years of proven results.,https://finnhub.io/api/news?id=1ac2db47b3888e09d611d36a4916255420c7998fecc3e41bffd0e8149e2b61e7,0.0,0.13333333333333333
company,1708951140,"We Could See More New Highs In Stocks, 4 Things Could Shut It Down",126136713,,MSFT,Seeking Alpha,Looking for stock market analysis and research with proves results? Zacks.com offers in-depth financial research with over 30years of proven results.,https://finnhub.io/api/news?id=a15f5b696a3226f7b187360141c396ee4ff51e90fc2f38a6aa8f2cfacb20f148,0.16026936026936026,0.13333333333333333
company,1708951080,Alphabet (NASDAQ:GOOGL) Reveals Microsoft’s Plan to Sell Bing to Apple,126146890,,MSFT,TipRanks,Looking for stock market analysis and research with proves results? Zacks.com offers in-depth financial research with over 30years of proven results.,https://finnhub.io/api/news?id=122b8571710b21744ae4ddd638389d5f158358c1e204e2f95388d7bbdcaf4515,0.0,0.13333333333333333
company,1708950770,Arm's Share Price Has Gotten Ahead Of Operating Growth,126139280,https://static.seekingalpha.com/cdn/s3/uploads/getty_images/1354828385/image_1354828385.jpg?io=getty-c-w1536,MSFT,SeekingAlpha,"Arm Holdings reports strong sales growth and margin strength, but concerns arise regarding overvaluation and potential share pullback. Read why I rate ARM stock a sell.",https://finnhub.io/api/news?id=a3fb030589bb80b762f0994a520589d8fb66071b5b9119a3ea1a61e08a850794,0.0,0.21666666666666667
company,1708948980,FPA Source Capital Inc. Fourth Quarter 2023 Commentary,126137787,,MSFT,Seeking Alpha,Looking for stock market analysis and research with proves results? Zacks.com offers in-depth financial research with over 30years of proven results.,https://finnhub.io/api/news?id=73c5b4d6a12388b9e7cff0b1bce86a36d00a04586278f39119e32d01c0e97078,0.0,0.13333333333333333
company,1708947540,10 Information Technology Stocks With Whale Alerts In Today's Session,126142222,,MSFT,Benzinga,Looking for stock market analysis and research with proves results? Zacks.com offers in-depth financial research with over 30years of proven results.,https://finnhub.io/api/news?id=71d43702eeedcf4559ba872be0e5a066a35525d8367a600dec11de87f11f7072,0.0,0.13333333333333333
company,1708947300,Alphabet (NASDAQ:GOOGL) Reveals Microsoft’s (NASDAQ:MSFT) Plan to Sell Bing to Apple (NASDAQ:AAPL),126146894,,MSFT,TipRanks,Looking for stock market analysis and research with proves results? Zacks.com offers in-depth financial research with over 30years of proven results.,https://finnhub.io/api/news?id=b6464cc63db9add00721466ead87866c295b169089ee55932ceb3af7a8c9bdf0,0.0,0.13333333333333333
company,1708947180,"C3.ai, SoundHound lead AI stocks higher",126151886,,MSFT,Seeking Alpha,Looking for stock market analysis and research with proves results? Zacks.com offers in-depth financial research with over 30years of proven results.,https://finnhub.io/api/news?id=a25f0989b4e2fe1dd6b1df9946379255c79080c4e070a5fdf85d50f1a09f4ee9,0.25,0.13333333333333333
company,1708945740,What You Missed On Wall Street This Morning,126138984,,MSFT,Thefly.com,Looking for stock market analysis and research with proves results? Zacks.com offers in-depth financial research with over 30years of proven results.,https://finnhub.io/api/news?id=5fb8f800c8a0aa62f76fac2de8c6519939af52ffa67c133a61e5358e46ff8040,0.0,0.13333333333333333
company,1708945200,"Buffett Sitting On Record Cash But Cannot Find Deals, Data Heavy Weak Ahead",126138445,,MSFT,Benzinga,Looking for stock market analysis and research with proves results? Zacks.com offers in-depth financial research with over 30years of proven results.,https://finnhub.io/api/news?id=4af798777d0dc98037a7081cb481d76752298b8befb682a3ed493d5e12fa5e85,-0.2875,0.13333333333333333
company,1708945200,Nvidia CEO Jensen Huang Uses These AI Tools 'Almost Every Day' For Research,126138987,,MSFT,Benzinga,Looking for stock market analysis and research with proves results? Zacks.com offers in-depth financial research with over 30years of proven results.,https://finnhub.io/api/news?id=014374d959d4d05ac1b04fae39d1b55b6969724d4c27ed61a5c6df4afda918ec,0.0,0.13333333333333333
company,1708944966,Microsoft: partnership with French startup Mistral AI,126136476,,MSFT,Finnhub,"Mistral AI, a French start-up specializing in generative artificial intelligence, announced on Monday that it had taken a further step towards making its technology accessible by signing a strategic...",https://finnhub.io/api/news?id=4c4ff63752f76d5f36e826fedf1562d87fb30fff579eaf1e52cc4bfe3ebd13b7,0.0,-0.056249999999999994
company,1708944480,"Here's the Only ""Magnificent Seven"" Stock That's Not Overpriced, According to the ""Dean of Valuation""",126132958,https://g.foolcdn.com/editorial/images/766559/digital-checklist-man.jpg,MSFT,Yahoo,"The cheapest ""Magnificent Seven"" stock from a few weeks ago isn't the cheapest today.",https://finnhub.io/api/news?id=fd54a2a14cdd8d03b58a3bb2c23fb0471428550f13d218ac9584963070b2c914,0.5,0.4
company,1708944060,Palantir and Microsoft: Top Analyst Daniel Ives Chooses the Best AI Stocks to Buy,126151891,,MSFT,TipRanks,Looking for stock market analysis and research with proves results? Zacks.com offers in-depth financial research with over 30years of proven results.,https://finnhub.io/api/news?id=d0da3e4b793c2e2597b45d5f92a21c15287a5859dfbdb4228f7c49899dc1e170,0.75,0.13333333333333333
company,1708942140,"Market Downturn? 3 Artificial Intelligence (AI) Stocks to Buy With $1,000 and Hold Forever",126133431,https://g.foolcdn.com/editorial/images/766231/big-data-analyst-ai-research.jpg,MSFT,Yahoo,Investors should start planning their purchases for when the market cools off. Consider adding these blue-chip AI stocks to your shopping list.,https://finnhub.io/api/news?id=2244d91f22ff3d8aa579a002e1a57ead01e26efa76b2356e285405464b93f422,-0.6,0.0
company,1708941048,Why To Add SCHO To Your Dividend Portfolio,126135202,https://static.seekingalpha.com/cdn/s3/uploads/getty_images/1650511381/image_1650511381.jpg?io=getty-c-w1536,MSFT,SeekingAlpha,"The Schwab Short-TermÂ U.S. Treasury ETF provides investors with an attractive risk-reward profile, given its low risk level. Read more about the SCHO ETF here.",https://finnhub.io/api/news?id=39462c2b34cf9ccc402afea18ad9102c6386f89b003378eb56ad7e346723386b,0.0,0.43333333333333335
company,1708939800,Microsoft offers AI solutions to Hong Kong insurer FWD in new 4-year partnership,126133433,https://s.yimg.com/cv/apiv2/social/images/yahoo_default_logo-1200x1200.png,MSFT,Yahoo,"Microsoft has extended its partnership with Hong Kong-based insurance provider FWD Group, signing a four-year agreement to provide generative artificial intelligence (AI) innovations, a move that highlights the US tech giant's continuing focus on Asia as companies race to integrate cutting-edge AI technology into their products and services. By extending the cooperation, FWD will gain access to Azure, the cloud computing platform of Microsoft, which is the biggest backer of OpenAI, the company b",https://finnhub.io/api/news?id=161d8c17e9980e841150ed9441b179011c37a59fdf129fab1b57e66a5626ccee,0.11818181818181818,-0.3
company,1708939560,Microsoft teams up with Mistral to bring start-up's AI model on Azure,126138990,,MSFT,Seeking Alpha,Looking for stock market analysis and research with proves results? Zacks.com offers in-depth financial research with over 30years of proven results.,https://finnhub.io/api/news?id=209c86b3eca155833ecd3710f2dd5f8ebebd84f5c21a83b6854940f5dbcf2ed0,0.0,0.13333333333333333
company,1708939320,"Market Clubhouse Morning Memo - February 26th, 2024 (Trade Strategy For SPY, QQQ, AAPL, MSFT, NVDA, GOOGL, META, And TSLA)",126137796,,MSFT,Benzinga,Looking for stock market analysis and research with proves results? Zacks.com offers in-depth financial research with over 30years of proven results.,https://finnhub.io/api/news?id=63682fa7f17ca188ef74145f07a05b016f332fc854e2cab7a7ed25dd2cef5222,0.0,0.13333333333333333
company,1708939080,Microsoft announces multi-year partnership with Mistral AI,126151897,,MSFT,Thefly.com,Looking for stock market analysis and research with proves results? Zacks.com offers in-depth financial research with over 30years of proven results.,https://finnhub.io/api/news?id=3bd311ea34c1cf7edacb395b9b09a3b487b819d9d09e5e6ddc01445bc3c2e6a1,0.0,0.13333333333333333
company,1708938386,Microsoft Strikes Deal With Mistral In Push Beyond OpenAI - FT,126134582,,MSFT,Finnhub,Feb 26 - * MICROSOFT STRIKES DEAL WITH MISTRAL IN PUSH BEYOND OPENAI- FTSource text: tinyurl.com/23lj4wbmFurther company coverage: ...,https://finnhub.io/api/news?id=8f8b759f4d7e627dca800bf1b5e6a1ce72e07bc82ed4f84f8a4791fe0e8d1acc,0.0,0.0
company,1708938060,France's Mistral announces AI partnership with Microsoft,126151901,,MSFT,Thefly.com,Looking for stock market analysis and research with proves results? Zacks.com offers in-depth financial research with over 30years of proven results.,https://finnhub.io/api/news?id=e61cb40c8d4564036e11550edf4e7de937f97545f151834afc807a9b70fe18cb,0.0,0.13333333333333333
company,1708936380,Hashi looks to benefit from 'cloud resurgence:' Morgan Stanley,126146904,,MSFT,Seeking Alpha,Looking for stock market analysis and research with proves results? Zacks.com offers in-depth financial research with over 30years of proven results.,https://finnhub.io/api/news?id=5c1d0eff53f0a464f06b416a4502d74637f84ae446166dac6593cb72c7d5607c,0.0,0.13333333333333333
company,1708936140,"Microsoft partnering with French AI start-up Mistral, FT reports",126151906,,MSFT,Thefly.com,Looking for stock market analysis and research with proves results? Zacks.com offers in-depth financial research with over 30years of proven results.,https://finnhub.io/api/news?id=f3095a0c542ab86fe1be0a8ba1f7bd2e174658992887b39631eb43253d2a8b10,0.0,0.13333333333333333
company,1708933980,Berkshire Hathaway market cap closes in on $1T after robust Q4 earnings,126137806,,MSFT,Seeking Alpha,Looking for stock market analysis and research with proves results? Zacks.com offers in-depth financial research with over 30years of proven results.,https://finnhub.io/api/news?id=834202398465426509f2902b6195f0cd2a3d88e83ec3e10ef067a16e1435a873,0.0,0.13333333333333333
company,1708930800,"Meta Is Back in Hiring Mode. For Investors, It’s a Race Between AI’s Cost and Its Eventual Benefits.",126131927,https://s.yimg.com/ny/api/res/1.2/PvB0F1i9MOFDIIzRmEhw3w--/YXBwaWQ9aGlnaGxhbmRlcjt3PTEyMDA7aD02MDA-/https://media.zenfs.com/en/Barrons.com/26aea0773faa43d6ef89e522d4aad702,MSFT,Yahoo,"Big Tech declared 2023 to be a year of efficiency. Now, Meta is growing headcount to improve its AI efforts.",https://finnhub.io/api/news?id=c4aabfa31ff7de76602bf7314884868a84d743cb9ea6b295a17684a9c33a75f5,0.0,0.0
company,1708930440,Political Calculations Unexpectedly Intriguing! 26 February 2024 S&P 500 Sparked To New Heights By NVDA's Blowout Earnings,126137729,,MSFT,TalkMarkets,Looking for stock market analysis and research with proves results? Zacks.com offers in-depth financial research with over 30years of proven results.,https://finnhub.io/api/news?id=c47e3de99a4381b6bc695e4b2587f503f1ec9570e2010de816bd52dca0a5d409,0.1704545454545455,0.13333333333333333
company,1708930380,Wall Street Breakfast: Flush With Cash,126137142,,MSFT,Seeking Alpha,Looking for stock market analysis and research with proves results? Zacks.com offers in-depth financial research with over 30years of proven results.,https://finnhub.io/api/news?id=61c7059577e223fb6aa02c8838e3a6c360473046bb41026717d3e93a665d1411,0.0,0.13333333333333333
company,1708930260,Analysts Offer Insights on Technology Companies: Docebo (DCBO) and Microsoft (MSFT),126148197,,MSFT,TipRanks,Looking for stock market analysis and research with proves results? Zacks.com offers in-depth financial research with over 30years of proven results.,https://finnhub.io/api/news?id=ad6661c05a3cdebc150ebd5639dfd2e117cb7675357748df0ed45f308a067a05,0.0,0.13333333333333333
company,1708928365,MAGS: The Magnificent 7 Are More Overvalued Than You Think,126132778,https://static.seekingalpha.com/cdn/s3/uploads/getty_images/157617977/image_157617977.jpg?io=getty-c-w1536,MSFT,SeekingAlpha,"MAGS ETF holds an equally weighted portfolio of the Magnificent 7 stocks, rebalancing on a quarterly basis. Read why I'm very bearish on the fund.",https://finnhub.io/api/news?id=53a277fdb9ba49358501237dbf032c2082f13804e4ab89dc05be3d45a48a4cb6,0.75,0.39999999999999997
company,1708926600,MSFT Stock Analysis: Microsoft’s Premium Valuation Is More Than Justified,126151916,,MSFT,InvestorPlace,Looking for stock market analysis and research with proves results? Zacks.com offers in-depth financial research with over 30years of proven results.,https://finnhub.io/api/news?id=a49a4db9d8a77525f3667f719b27aa6e3f02d3123b5bd05999b6b06504bc9385,0.45,0.13333333333333333
company,1708926360,"Microsoft Almost Sold Bing To Apple Back In 2018, But Google's Court Documents Reveal Why Deal Didn't Go Through",126138997,,MSFT,Benzinga,Looking for stock market analysis and research with proves results? Zacks.com offers in-depth financial research with over 30years of proven results.,https://finnhub.io/api/news?id=26465d00abb30f27d9299d14d4416fe7cd81cfd37442d9c92b4e34767bf65d56,0.0,0.13333333333333333
company,1708923660,Beyond Market Price: Uncovering Microsoft Corp's Intrinsic Value,126151919,,MSFT,GuruFocus,Looking for stock market analysis and research with proves results? Zacks.com offers in-depth financial research with over 30years of proven results.,https://finnhub.io/api/news?id=5f55f2b61891690f19cbef9187fdbf4bc6204d45d2f09d1d52be7a18aa769d77,0.0,0.13333333333333333
company,1708923120,"Google says Microsoft offered to sell Bing to Apple in 2018, CNBC reports",126139000,,MSFT,Thefly.com,Looking for stock market analysis and research with proves results? Zacks.com offers in-depth financial research with over 30years of proven results.,https://finnhub.io/api/news?id=21e97bce0540edef014bcdfe03c178dc01136a93cf155ed20f6638484b3094ea,0.0,0.13333333333333333
company,1708919760,Buy Rating on Microsoft: Strategic AI Partnerships Poised to Enhance SaaS Offerings and Operating Margins,126151921,,MSFT,TipRanks,Looking for stock market analysis and research with proves results? Zacks.com offers in-depth financial research with over 30years of proven results.,https://finnhub.io/api/news?id=80befcb345edebd1f06c6f61264b4816fd2b884e799749dd8fcd25009ccdd5a4,0.0,0.13333333333333333
company,1708917780,What You Missed On Wall Street On Monday,126146913,,MSFT,Thefly.com,Looking for stock market analysis and research with proves results? Zacks.com offers in-depth financial research with over 30years of proven results.,https://finnhub.io/api/news?id=455540b33acd1f34cef2af853ece782888df29a5db1f62953de837ff606c9b72,0.0,0.13333333333333333
company,1708917600,The Golden Years: 7 Dividend Champions to Secure Your Retirement,126150206,,MSFT,InvestorPlace,Looking for stock market analysis and research with proves results? Zacks.com offers in-depth financial research with over 30years of proven results.,https://finnhub.io/api/news?id=4fc657954f14b50ed810730c84206916960d2ad793f4a6a8a07b2ea4e8247f97,0.35,0.13333333333333333
company,1708916820,Market Today: AI Stocks Surge as C3.ai and SoundHound Lead Gains,126146914,,MSFT,GuruFocus,Looking for stock market analysis and research with proves results? Zacks.com offers in-depth financial research with over 30years of proven results.,https://finnhub.io/api/news?id=299e6050c32b49eee1f26fb9b416219d3c3014ba6c13e1c87a075c218dfb1bf9,0.0,0.13333333333333333
company,1708906821,"Dow Jones Futures Fall; Nvidia Rival AMD Setting Up, But Stock Market Needs This",126128001,https://media.zenfs.com/en/ibd.com/7147c48c8897e84dc52aac4692b4ce8f,MSFT,Yahoo,"Stocks jumped to highs thanks to Nvidia, and The major indexes jumped to highs, but a longer pause would be welcome. A longer pause would be welcome. AMD and Microsoft are setting up.",https://finnhub.io/api/news?id=5895172cdfbb7a67c555487c4a88956558e7298470344f41bba473d437c6b3ca,0.0,0.465625
company,1708915680,Google: Microsoft offered to sell Bing to Apple when pitching default deal,126139001,,MSFT,Seeking Alpha,Looking for stock market analysis and research with proves results? Zacks.com offers in-depth financial research with over 30years of proven results.,https://finnhub.io/api/news?id=d22ded93c46b4ff6ee0d6ae4a315bfa72acc4620e0b2d5a520a62ffb8184385f,0.0,0.13333333333333333
company,1708915020,Microsoft (NASDAQ:MSFT) Invests in French AI Startup,126151926,,MSFT,TipRanks,Looking for stock market analysis and research with proves results? Zacks.com offers in-depth financial research with over 30years of proven results.,https://finnhub.io/api/news?id=2e334386b987b4e221999a64cd580800a712c73990ce65a96f21d850336e3cb8,0.0,0.13333333333333333
company,1708914060,Antitrust Regulator Files Lawsuit To Block Kroger's $25B Bid For Albertsons,126145860,,MSFT,Benzinga,Looking for stock market analysis and research with proves results? Zacks.com offers in-depth financial research with over 30years of proven results.,https://finnhub.io/api/news?id=f65993441c252477741927943f98392ead52e6ab049f86e684531b495a9cfd37,0.0,0.13333333333333333
company,1708913640,3 BlackRock Stock Favorites That You Need to Know About,126149884,,MSFT,InvestorPlace,Looking for stock market analysis and research with proves results? Zacks.com offers in-depth financial research with over 30years of proven results.,https://finnhub.io/api/news?id=7243878f13876765284c777315950384aa630d75bd60ce5102a22598ff34419c,0.0,0.13333333333333333
company,1708913366,"Turning More Cautious On The Mag 7, Prefer JEPQ Over QQQ (Rating Upgrade)",126130564,,MSFT,SeekingAlpha,,https://finnhub.io/api/news?id=b407e8c0f5976db64a02936ba9ab9144c61e365efd42bcee690c30e7cb239b40,0.5,0.0
company,1708912800,PRESS: Disney and India's Reliance agree merger - Bloomberg,126136716,,MSFT,Alliance News,Looking for stock market analysis and research with proves results? Zacks.com offers in-depth financial research with over 30years of proven results.,https://finnhub.io/api/news?id=870365e4359443d645b606dfe1dd618cc8b56b9d42b8f4b23c211c0b7b1bf0f9,0.0,0.13333333333333333
company,1708912020,7 High-Upside Tech Stocks to Buy That Also Pay Dividends,126143036,,MSFT,InvestorPlace,Looking for stock market analysis and research with proves results? Zacks.com offers in-depth financial research with over 30years of proven results.,https://finnhub.io/api/news?id=d0d5dcb54148fff2fb73b0c07ff7102ceb7f329255edeb8ef7c8b17c4949f5c4,0.0,0.13333333333333333
company,1708911720,Ambitious Plans for AI’s Future Can’t Save Microsoft (NASDAQ:MSFT) Shares,126151933,,MSFT,TipRanks,Looking for stock market analysis and research with proves results? Zacks.com offers in-depth financial research with over 30years of proven results.,https://finnhub.io/api/news?id=b3f70c5c465e3cae2219b079804f70aa59363d26d6b9c8db627c817bbbaf93cb,0.125,0.13333333333333333
company,1708911420,3 Loved Stocks That Hedge Funds Are Buying in Bulk,126144271,,MSFT,InvestorPlace,Looking for stock market analysis and research with proves results? Zacks.com offers in-depth financial research with over 30years of proven results.,https://finnhub.io/api/news?id=2578c3bdb966641301c44925f25b4bb709816e12bfb6f6197b2690742d34cc28,0.7,0.13333333333333333
company,1708908257,Google's AI Mistakes Are A Potential Risk For Shareholders,126129984,https://static.seekingalpha.com/cdn/s3/uploads/getty_images/1754139880/image_1754139880.jpg?io=getty-c-w1536,MSFT,SeekingAlpha,Google's cautious approach to its AI rollout led to serious controversy when Gemini was caught giving inaccurate output. Learn why GOOG stock is a Buy.,https://finnhub.io/api/news?id=2821a90bb84619489389882740e7a3a6c8b7244e192016a104b984f13d5a72a2,0.0,-0.3333333333333333
company,1708891129,SP500: Correction Delayed By The Nvidia Melt-Up,126128183,https://static.seekingalpha.com/cdn/s3/uploads/getty_images/1494623409/image_1494623409.jpg?io=getty-c-w1536,MSFT,SeekingAlpha,The correction in S&P 500 was interrupted by the Nvidia melt-up after the earnings release. Read why my SP500 rating is still a Hold.,https://finnhub.io/api/news?id=d8799c11ca505078af9a41b68ea26d45f4355a0edbddc7d3bdc5da6d6730c20b,0.0,0.0
company,1708884600,1 Growth Stock Down 65% to Buy Right Now,126126461,https://g.foolcdn.com/editorial/images/766128/gettyimages-1421329910-1201x755-91c7fdd.jpg,MSFT,Yahoo,This cybersecurity stock is flying under the radar despite strong financial results.,https://finnhub.io/api/news?id=4bb212eb9767ce871384cc5d24d374ff3dbc877a1850f1acd006712d4c716dba,0.06507936507936507,0.21666666666666667
company,1708880450,How an AI feud is roiling the music industry,126122739,https://s.yimg.com/ny/api/res/1.2/EQYI8fYFfWWbS62fEw4ihg--/YXBwaWQ9aGlnaGxhbmRlcjt3PTEyMDA7aD04MDA-/https://s.yimg.com/os/creatr-uploaded-images/2024-02/01f916b0-d267-11ee-a33b-bebe2abc03d8,MSFT,Yahoo,A feud between Universal Music and TikTok is triggering a larger debate across the music business about whether to embrace AI — or fight it.,https://finnhub.io/api/news?id=bcd76e6b01ae09e16b2541407302b11e617a21efcb52693fc01c059f824edfd5,0.0,0.0
company,1708879791,Jim Cramer Says Do Not Buy These 11 Stocks,126123207,https://media.zenfs.com/en/insidermonkey.com/dc5a2bcb6b4c16a43cb5b4ba98feb139,MSFT,Yahoo,"In this article, we will take a detailed look at the Jim Cramer Says Do Not Buy These 11 Stocks. For a quick overview of such stocks, read our article Jim Cramer Says Do Not Buy These 5 Stocks. Jim Cramer continues to challenge the market bears after NVIDIA Corp (NASDAQ:NVDA) smashed the Wall Street estimates with another stunning […]",https://finnhub.io/api/news?id=384d1b0e769d4d7588129c23d0a201b994f772ed5f9d751deada2281b0910598,0.0,0.30833333333333335
