category,datetime,headline,id,image,related,source,summary,url,headline_sentiment,summary_sentiment
company,1709163194,"US SEC investigating if OpenAI investors were misled, WSJ reports",126185883,,MSFT,Finnhub,"The Securities and ExchangeCommission is scrutinizing internal communications by OpenAIChief Executive Sam Altman as part of an investigation intowhether the company's investors were misled, the...",https://finnhub.io/api/news?id=a5032b4c5d9af542f48a1f15c2dd759900cbc4a640e7f4a73f84db799d744897,-0.1,0.0
company,1709160321,Microsoft (MSFT) Ascends While Market Falls: Some Facts to Note,126191235,,MSFT,Yahoo,"In the closing of the recent trading day, Microsoft (MSFT) stood at $407.72, denoting a +0.06% change from the preceding trading day.",https://finnhub.io/api/news?id=4aa2edaedb91b49e678a63def21ff8f8ea66816b564baddc0a7b6d212e50ed87,0.0,0.0
company,1709158573,"HP CEO: PC demand remains a challenge, though AI computers are coming",126185519,https://s.yimg.com/ny/api/res/1.2/SHR6Ja0a6wW1OQL3HErK5g--/YXBwaWQ9aGlnaGxhbmRlcjt3PTEyMDA7aD04MDA-/https://s.yimg.com/os/creatr-uploaded-images/2024-02/ca803540-d67d-11ee-9fee-b9a96ef82766,MSFT,Yahoo,HP missed estimates on its first quarter revenue as the PC market continues to struggle.,https://finnhub.io/api/news?id=75a0adc3bc8807821d5eb6e99fa55ce3e023a6605d01e014c2ccb058f7c3ab20,0.0,0.25
company,1709157609,Tracking Al Gore's Generation Investment Management Portfolio - Q4 2023 Update,126185141,,MSFT,SeekingAlpha,,https://finnhub.io/api/news?id=16f74ca60d19f29ec80edb906571ec0dec501fa988dad154b5bb34f6784b1287,0.0,0.0
company,1709154091,Prodigal Stock Goes AWOL Then Returns With 108% — And Rising — Gain,126184201,https://media.zenfs.com/en/ibd.com/6a21c2a121750c9de26bfae8f8f6f422,MSFT,Yahoo,"After getting banished from this exclusive list of long-term leaders, Copart returns and pops back into buy range.",https://finnhub.io/api/news?id=f0ed81fbc4e1f4dfc29ce6efbde23df3d882b3a9ee1f364b2b9dc3a8a2bfcf72,0.0,0.0
company,1709153154,50 Best Countries in the World,126184596,https://s.yimg.com/ny/api/res/1.2/4.vXepFx42RzGezU82n.jA--/YXBwaWQ9aGlnaGxhbmRlcjt3PTEyMDA7aD02NzM-/https://media.zenfs.com/en/insidermonkey.com/c4c690789a277f1f1dfe25ce8e024a1a,MSFT,Yahoo,"In this article, we will look into the 50 best countries in the world. If you want to skip our detailed analysis, you can go directly to the 10 Best Countries in the World. The Best Country: A Multifaceted Concept In today’s digital and advanced era, many factors contribute to the concept of a “best […]",https://finnhub.io/api/news?id=84dd786eb646ca974ced4164fb49f6cfb6ea9caae7ee7e115817899be04c6f97,1.0,0.6000000000000001
company,1709148224,Google's AI blunder shows risks in scramble to catch up to Microsoft,126186772,https://s.yimg.com/ny/api/res/1.2/b2shFIvITqMwuG4KpI5t4Q--/YXBwaWQ9aGlnaGxhbmRlcjt3PTEyMDA7aD04MDA-/https://s.yimg.com/os/creatr-uploaded-images/2024-02/e6b31330-d192-11ee-bdff-82e12211f86c,MSFT,Yahoo,Google's attempt to ensure its AI tools depict diversity has drawn backlash as the ad giant tries to catch up to rivals.,https://finnhub.io/api/news?id=446b34521fcf3213d8e6618fa272086b954032b7a0a4ca82119d015d08dcae1c,0.0,-0.05
company,1709147644,Generative AI is having a throw-everything-at-the-wall moment,126184347,https://s.yimg.com/ny/api/res/1.2/Sa_pfKp9mP5aEoHL5l89QA--/YXBwaWQ9aGlnaGxhbmRlcjt3PTEyMDA7aD04MDA-/https://s.yimg.com/os/creatr-uploaded-images/2024-02/c078f840-d65d-11ee-97f6-23917e947fc5,MSFT,Yahoo,The tech industry is throwing generative AI at everything it can think of to see what sticks in the hopes of developing the next big thing.,https://finnhub.io/api/news?id=78871a5299c33b3bcd8de21598f8795a8b1d3198a42080210ce3dcf829ad9333,0.0,0.0
company,1709145022,Be wary of 'concentration risks' in tech ETFs: Strategist,126185061,https://s.yimg.com/ny/api/res/1.2/JQu4Iv9gdKdSqKoyZTXZfA--/YXBwaWQ9aGlnaGxhbmRlcjt3PTEyMDA7aD02ODY-/https://s.yimg.com/os/creatr-uploaded-images/2024-02/6db77f80-d664-11ee-b7f3-ab0195f57f54,MSFT,Yahoo,"Tech ETFs saw massive inflows of over $17 billion last year, according to VettaFi. However, Financial Futurist Dave Nadig, says many are ""overdone"" in mega-caps like Nvidia (NVDA) and Meta (META) which drive gains. He warns of ""concentration risks,"" noting that in the Technology Select Spdr Fund (XLK) just 5 names account for more than 50% of the fund. Nadig advises those investing in tech to ""look for strategies that are a little bit more equal-weighted."" He suggests something like the Robo Global Robotics and Automation Index ETF (ROBO) which is ""much more balanced"" with global diversification across use cases. Many tech ETFs have ""hyper-concentrated"" portfolios, with stocks like Microsoft (MSFT), for example, dominating the top holdings. On the days that dominate stock does well, ""performance will beat everybody else,"" while down days see similar exaggerated moves. Nadig recommends focusing on long-term plays that ""benefit over the cycle, not just over the headline."" Beyond tech, Nadig highlights healthcare as an attractive sector, suggesting the Simplify Healthcare ETF (PINK) for exposure without ""veering entirely"" into biotech/pharma - providing ""nice balance."" For more expert insight and the latest market action, click here to watch this full episode of Yahoo Finance Live. Editor's note: This article was written by Angel Smith",https://finnhub.io/api/news?id=e0ddcc3d131096fb3c6accf2d356459eba8706922947aeb5772acd7bd1273fa8,-0.5,0.2101378367003367
company,1709143848,"Microsoft Probes Reports Bot Issued Bizarre, Harmful Responses",126186775,https://s.yimg.com/ny/api/res/1.2/lYzB0M1FN1euc6ViXOrnyg--/YXBwaWQ9aGlnaGxhbmRlcjt3PTEyMDA7aD04MDA-/https://media.zenfs.com/en/bloomberg_technology_68/5a93d2d7865be57fd797bdbdc8a441c7,MSFT,Yahoo,"(Bloomberg) -- Microsoft Corp. said it’s investigating reports that its Copilot chatbot is generating responses that users have called bizarre, disturbing and, in some cases, harmful. Most Read from BloombergHow Much Wealth You Need to Join the Richest 1% Around the WorldApple to Wind Down Electric Car Effort After Decadelong OdysseyThis Is Where New Migrants Are Going When They Reach the USSupreme Court Immunity Case Jeopardizes Trump Trial Pre-ElectionFlawed Valuations Threaten $1.7 Trillion P",https://finnhub.io/api/news?id=25eaee55cddc73cdc56b3766b570f58ff01eabc95c1f205d54f5abf4f0aeb7ed,0.4,0.09680134680134682
company,1709141100,"Microsoft Has $50 Billion Ad Opportunity, Barclays Says. There Are Multiple Growth Levers.",126186776,https://s.yimg.com/ny/api/res/1.2/nqh3LaPQuuZo7X3LFqfqVA--/YXBwaWQ9aGlnaGxhbmRlcjt3PTEyMDA7aD02MDA-/https://media.zenfs.com/en/Barrons.com/bf2f9079b38eb3a45ee0d2fe3ffa4904,MSFT,Yahoo,"Microsoft  has a $50 billion opportunity in advertising,  Barclays  argued on Wednesday.  The search segment, led by Bing, represents the largest market opportunity, the ad-tech offerings are still in their early stages but have potential, and “LinkedIn has become the largest business-to-business advertising player in the world,” the analysts wrote.",https://finnhub.io/api/news?id=242dec5e6f8bf2d2d88d488e88da70ac210878fddb80e1bb212050914dc4c224,0.0,0.05
company,1709140024,BBC to write headlines using artificial intelligence,126191244,https://s.yimg.com/ny/api/res/1.2/mBtP1AkDHxQ.Af2HjCGnEg--/YXBwaWQ9aGlnaGxhbmRlcjt3PTEyMDA7aD03NTM-/https://media.zenfs.com/en/the_telegraph_818/d76a36477f6e5080169b48c7603a4c75,MSFT,Yahoo,BBC journalists will use artificial intelligence (AI) to write headlines as part of wider trials of the new technology at the corporation.,https://finnhub.io/api/news?id=f8aac033797f7680015dc7989b13ba381f1319f15e39c3ab41279fc93dc25238,-0.6,-0.2318181818181818
company,1709137980,Microsoft Corp. stock outperforms competitors on strong trading day,126257016,https://images.mktw.net/im-220105/social,MSFT,MarketWatch,"Shares of Microsoft Corp. inched 0.06% higher to $407.72 Wednesday, on what proved to be an all-around dismal trading session for the stock market, with the...",https://finnhub.io/api/news?id=b1194a190b52c44ec65e12a64990dc32869b71c67bb4b3d2b792bc124a4bc84f,0.43333333333333335,0.225
company,1709135998,Has the Magnificent Seven's market run come to an end?,126186777,https://s.yimg.com/ny/api/res/1.2/hcxPDt3jbjmR6tMc4.FlIA--/YXBwaWQ9aGlnaGxhbmRlcjt3PTEyMDA7aD02NzY-/https://s.yimg.com/os/creatr-uploaded-images/2024-02/5e7062b0-d652-11ee-9ffb-20aea1482845,MSFT,Yahoo,"The so-called Magnificent Seven mega-cap stocks have powered much of the S&P 500's gains. However, their dominant run may be ending, according to JonesTrading Chief Market Strategist Mike O'Rourke. O'Rourke pointed to recent earnings from Meta (META) and Nvidia (NVDA) that ""shattered"" expectations yet saw different market reactions. He notes the Magnificent Seven valuations have diverged ""drastically,"" causing investors to ""differentiate"" between them rather than treat them as a uniform group. As growth moderates for these mega-cap stocks, O'Rourke expects ""rotation"" within the Magnificent Seven tech companies as investors compare valuations and future trajectories. He believes this could force funds into other promising areas of the market beyond the narrow mega-cap technology focus, like biotech and pharma. For more expert insight and the latest market action, click here to watch this full episode of Yahoo Finance Live. Editor's note: This article was written by Angel Smith",https://finnhub.io/api/news?id=ffabb85ec481e1a4f2ac52b93233a4943ba2bbc1e192a1f3ba36cacdedc7b0ab,1.0,0.31075757575757573
company,1709135280,"Digital outlets The Intercept, Raw Story and AlterNet sue OpenAI for unauthorized use of journalism",126201787,,MSFT,"Associated Press, The",Looking for stock market analysis and research with proves results? Zacks.com offers in-depth financial research with over 30years of proven results.,https://finnhub.io/api/news?id=f5dd3da409018ab4d2a19a9fd044f137266b42de165e48dd35ec930f0f42b62d,-0.11538461538461539,0.13333333333333333
company,1709133442,12 Best ESG Dividend Stocks to Buy According to Hedge Funds,126184577,https://media.zenfs.com/en/insidermonkey.com/c053eebc39563163edfaf2b48c0f72ca,MSFT,Yahoo,"In this article, we discussed 12 best ESG dividend stocks according to hedge funds. You can skip our detailed analysis of ESG investing and its prospects, and go directly to read 5 Best ESG Dividend Stocks to Buy According to Hedge Funds. The concept of ESG, which stands for Environmental, Social, and Governance, was initially […]",https://finnhub.io/api/news?id=bb443588d5a39808c0a0fcaaf63c3826fc079047ac59dbaf28a0040c323a7428,1.0,0.4222222222222222
company,1709132095,3 companies are driving the 'Magnificent 7' trade,126184817,https://s.yimg.com/ny/api/res/1.2/2jGmQRJOultmu4iXfMvMOA--/YXBwaWQ9aGlnaGxhbmRlcjt3PTEyMDA7aD04MDA-/https://s.yimg.com/os/creatr-uploaded-images/2024-02/2d58bde0-d10b-11ee-bbed-d211f90dabd2,MSFT,Yahoo,Improved earnings estimates for a few select tech companies show why their stocks are outperforming peers.,https://finnhub.io/api/news?id=d649bbd77a6d9b19870091003e84c8cf7e343c9ed2a57df501eae8aa136a73a7,1.0,-0.2
company,1709124180,Amazon's Innovation Fund Expands Horizon - From Mantis Robotics to 'Last Mile' Delivery Investments,126200229,,MSFT,Benzinga,Looking for stock market analysis and research with proves results? Zacks.com offers in-depth financial research with over 30years of proven results.,https://finnhub.io/api/news?id=4c7a6ecd5043e321b6e3803478f7f96cdb984ff716d1a727c5192b7b1d853d21,0.0,0.13333333333333333
company,1709119560,"Opportunities For Investors Beyond AI And Nvidia – Biotech Breaks Out, New GDP Data Shows Inflation Pressure",126200233,,MSFT,Benzinga,Looking for stock market analysis and research with proves results? Zacks.com offers in-depth financial research with over 30years of proven results.,https://finnhub.io/api/news?id=f4b58a4b3a5b18d02b877591b25e143b915bc61554fd42e1c631b6f270a2f9c7,0.13636363636363635,0.13333333333333333
company,1709115300,RiverPark Long/Short Opportunity Fund Q4 2023 Investor Letter,126179909,https://static.seekingalpha.com/cdn/s3/uploads/getty_images/2040463902/image_2040463902.jpg?io=getty-c-w1536,MSFT,SeekingAlpha,"The RiverPark Long/Short Opportunity Fund returned 15.75% in Q4 2023, versus the S&P 500 Total Return Index, which returned 11.69%. Click here to read more.",https://finnhub.io/api/news?id=8ee5f324ccbc110f7f34c23850e662e5eb8ababf1ed630201bbc671ac3f1ac8a,0.0,0.25
company,1709115000,"Bernard Horn Adjusts Portfolio, Exits Honda Motor Co Ltd Position",126201791,,MSFT,GuruFocus,Looking for stock market analysis and research with proves results? Zacks.com offers in-depth financial research with over 30years of proven results.,https://finnhub.io/api/news?id=db3a5eb4993fa1a78caa5a67967f5aad6bdaecff77fb624d376fd79d023a3765,0.0,0.13333333333333333
company,1709115000,MS Global Franchise Portfolio Adjusts Holdings with a Notable Decrease in Reckitt Benckiser ...,126198306,,MSFT,GuruFocus,Looking for stock market analysis and research with proves results? Zacks.com offers in-depth financial research with over 30years of proven results.,https://finnhub.io/api/news?id=72b6a9df04a695aa6295288c3b2198ddb67f7b2e6546725fa71070960708d38e,0.25,0.13333333333333333
company,1709114940,EARNINGS PREVIEW: London Stock Exchange Group growth may ease in 2024,126201793,,MSFT,Alliance News,Looking for stock market analysis and research with proves results? Zacks.com offers in-depth financial research with over 30years of proven results.,https://finnhub.io/api/news?id=7c51d56aef40fe8d988b8550b80f10d0a8c78b64b385255db84908532f82bd43,0.0,0.13333333333333333
company,1709114940,Meta's Ambitious Plan - Zuckerberg Discusses AI and Extended Reality with LG in Seoul,126201792,,MSFT,Benzinga,Looking for stock market analysis and research with proves results? Zacks.com offers in-depth financial research with over 30years of proven results.,https://finnhub.io/api/news?id=0ff01849e113c092c30c0a3a1f5188981687ee182e3f9cdc6a39d6b0b4b15359,0.25,0.13333333333333333
company,1709114160,"'Enormous 8' Member Netflix Just Made New 52-Week High, Valuations Suggest Profit-Taking Opportunity",126200238,,MSFT,Benzinga,Looking for stock market analysis and research with proves results? Zacks.com offers in-depth financial research with over 30years of proven results.,https://finnhub.io/api/news?id=1f6d9287c65623243bfa5321706327e2d66a0bcd26b28b77e792ed586add0d87,0.0987878787878788,0.13333333333333333
company,1709113440,"Market Clubhouse Morning Memo - February 28th, 2024 (Trade Strategy For SPY, QQQ, AAPL, MSFT, NVDA, GOOGL, META, And TSLA)",126201795,,MSFT,Benzinga,Looking for stock market analysis and research with proves results? Zacks.com offers in-depth financial research with over 30years of proven results.,https://finnhub.io/api/news?id=4526c2676c91ff192d4244b41fac5801e0eb73bb2923b245b2c4867f221f4ad6,0.0,0.13333333333333333
company,1709112600,Microsoft and Bosch team up to make autonomous driving more intuitive,126201796,,MSFT,Seeking Alpha,Looking for stock market analysis and research with proves results? Zacks.com offers in-depth financial research with over 30years of proven results.,https://finnhub.io/api/news?id=afa5d85d9b20377e28d7c7e585c18a968c8f271fde23ccf2f3f35fedf24082a7,0.45,0.13333333333333333
company,1709112300,Lux Capital Q4 2023 Report,126179704,https://static.seekingalpha.com/cdn/s3/uploads/getty_images/1145882183/image_1145882183.jpg?io=getty-c-w1536,MSFT,SeekingAlpha,"In our last quarterly letter, our focus was on realism. We continue this reasoning with a contrarian take: you canât look too far into the future. Click here to read more.",https://finnhub.io/api/news?id=829d4f69d2bba894f8eabc9647b45302c53d0288d8d53eadcf2cae93f5da5e9e,0.0,0.15
company,1709106007,Conductor by Diagrid Now Available in Microsoft Azure Marketplace,126178971,,MSFT,Finnhub,"FEDERAL WAY, Wash. - Diagrid, provider of tools and services to build reliable and portable applications using Dapr, today announced the availability of Conductor in the Microsoft Azure Marketplace,...",https://finnhub.io/api/news?id=1b910835efa5fb0c4f23c75e1a0e79a6f901bacbda07ddfb5e4c26c385abe843,0.4,0.0
company,1709105137,"France had no prior knowledge of Microsoft's Mistral AI deal, official says",126178783,,MSFT,Finnhub,"France had no prior knowledgeof Microsoft's partnership with tech startup Mistral AI, afinance ministry official told Reuters, denying suggestions thatFrench lobbying for looser European AI rules...",https://finnhub.io/api/news?id=cba473f8e1b67d12957304eb6b0cc521884b431bd78df6a8c6ca48e6be91bf46,0.0,0.0
company,1709102760,"Meta Turns to LG to Hit Back at Apple Vision Pro, and Other Technology News Today",126180787,https://images.barrons.com/im-789624/social,MSFT,MarketWatch,Mark Zuckerberg is hoping a deeper relationship with LG Electronics can help stave off Apple’s competition in virtual-reality headsets.,https://finnhub.io/api/news?id=14d5388d1f983e0e0bd678cb63dae7dc311789860e74944d5ea290c093f96a6e,-0.0625,0.0
company,1709085615,UPDATE 1-EU probes Microsoft's security software practices,126174757,https://s.yimg.com/cv/apiv2/social/images/yahoo_default_logo-1200x1200.png,MSFT,Yahoo,"The European Commission is probing if Microsoft is preventing customers from relying on certain security software from its competitors, according to a document that regulators sent to at least one rival in January, seen by Reuters.  Companies over the years have complained about Microsoft's bundling services and its cloud-computing practices, which European regulators have investigated.  Microsoft has said it has worked to address rivals' concerns.",https://finnhub.io/api/news?id=448c57da7853e861c6add250ee2eb3e172f657422513896c7d07208f3a31d21b,0.0,-0.07714285714285714
company,1709081189,Capital Group Says ‘Gentle Bubble’ Is Forming in US Tech Stocks,126174759,https://media.zenfs.com/en/bloomberg_markets_842/6810b7ae54b35ed32e25b17f7f78bd23,MSFT,Yahoo,(Bloomberg) -- Capital Group Cos. is shuffling stakes in US technology names amid the blowout rally in the Magnificent Seven megacaps.Most Read from BloombergApple to Wind Down Electric Car Effort After Decadelong OdysseyHow Much Wealth You Need to Join the Richest 1% Around the WorldOffice Tower Deal for $1 Reveals Anxiety Among Longtime BuyersA Spike in Heart Disease Deaths Since Covid Is Puzzling ScientistsNvidia’s $70 Million Florida Supercomputer Hobbled by DeSantis LawThe $2.5 trillion man,https://finnhub.io/api/news?id=e04711b824688d996f8a392ad49211d7dc3a0d009b05e376f8e1b1bc76d62149,0.2,0.34814814814814815
company,1709074450,OpenAI CEO Sam Altman Has a Major Stake in This Hot IPO Stock. Should You Follow His Lead?,126173249,https://g.foolcdn.com/editorial/images/766687/investing-education-reading-stocks-home-young.jpg,MSFT,Yahoo,"Reddit has finally filed to go public, and one of its largest investors is the CEO of ChatGPT developer OpenAI.",https://finnhub.io/api/news?id=65c16dc79047b010c07155492861c6942101ff791c858e82a9cddaf87a276d2e,0.15625,0.0
company,1709071373,"Gen Z, Millennial investors tend to chase FOMO trade: Survey",126173173,https://s.yimg.com/ny/api/res/1.2/a4g1Gu6pGW0VYWjNDquj4g--/YXBwaWQ9aGlnaGxhbmRlcjt3PTEyMDA7aD02NzY-/https://s.yimg.com/os/creatr-uploaded-images/2024-02/c83a7920-d5bb-11ee-bdf3-90f716c9ad35,MSFT,Yahoo,"Younger investors — Millennials and Gen Z — seem to have FOMO as they are more likely to chase momentum behind earnings, according to Apex Fintech Solutions latest survey. Apex Fintech Solutions CEO Bill Capuzzi sits down with Yahoo Finance to discuss these FOMO trading trends observed from the most recent earnings seasons, especially across the Magnificent 7 tech stocks. ""When I look at the data in terms of the pattern, those 26 and younger year olds, there was a bit of fear of missing out. The great earnings and the amount of activity in that name [Meta (META)] was significant compared to something like Uber (UBER), which also posted really good earnings,"" Capuzzi says. ""What it tells me is you have this younger generation — this notion [of] Peter Lynch which is 'invest in what you know, invest in what you use' — in this case, you have this younger generation leaning into things they use today, number one, and number two, think that there's opportunity for that stock to continue to run."" For more expert insight and the latest market action, click here to watch this full episode of Yahoo Finance Live. Editor's note: This article was written by Luke Carberry Mogan.",https://finnhub.io/api/news?id=af9c1febd099988b669159d5859dd7a591be8f0330087cd996cbde1e8a127e74,0.0,0.23662764003673092
company,1709068550,EU probes Microsoft's security software practices,126174768,https://media.zenfs.com/en/reuters-finance.com/af38d778dbd28d0d1e810c11ca64cfc8,MSFT,Yahoo,"Companies over the years have complained about Microsoft's bundling services and its cloud-computing practices, which European regulators have investigated.  Microsoft has said it has worked to address rivals' concerns.  The European Commission, which serves as the EU's competition watchdog, is examining Microsoft's Entra ID software, previously known as Azure Active Directory.",https://finnhub.io/api/news?id=16a9ab61c05fa8a3e62be4eeaa4680d7f922ff97c19c38b069772df09f456110,0.0,-0.12
company,1709068403,"EU antitrust probes Microsoft's security software practices, Information reports",126174770,https://s.yimg.com/cv/apiv2/social/images/yahoo_default_logo-1200x1200.png,MSFT,Yahoo,"European Union regulators are probing if Microsoft is preventing its customers from buying security software from its competitors, the Information reported on Tuesday, citing a document the EU sent to at least one rival in January.  Regulators from the European Commission, which serves as the EU's competition watchdog, are examining Microsoft's Entra ID software, previously known as Azure Active Directory, the report said.  Alphabet's Google Cloud on Monday ramped up its criticism of Microsoft's cloud computing practices, saying its rival is seeking a monopoly that would harm the development of emerging technologies such as generative artificial intelligence.",https://finnhub.io/api/news?id=0caa62a7fa57da52c0e85780e2c8ec59d8a444fc3afae574945d70ff9e16ec9c,0.0,-0.17142857142857143
company,1709065629,Zoom Tops Estimates As It Pledges To Democratize AI Access,126170991,https://media.zenfs.com/en/Benzinga/32fa7303b025f256740ce3fcd1d013f3,MSFT,Yahoo,"Zoom Video Communications Inc (NASDAQ: ZM) joined Big Tech players such as Microsoft Corporation (NASDAQ: MSFT) in riding the AI-hype wave. Despite intense and scary competition from Microsoft and Alphabet (NASDAQ: GOOG)(NASDAQ: GOOGL)-owned Google, Zoom managed to hold its ground as the industry finds itself in a period of transition as new AI-powered era continues to unfold. Zoom was a rewarded for its results with shares rising as much as 13% on Monday during extended trading. Fiscal Fourth Q",https://finnhub.io/api/news?id=13328cc3d379bcaed51c02100ebe8de87db2c6bdf81ff1fad0e04ff2cc8d5c47,0.0,0.0051948051948051965
company,1709063544,"Mutual Funds Stockpile AI Stocks Meta Platforms, Microsoft",126170992,https://media.zenfs.com/en/ibd.com/5219d37d4f5ee3bdfbb5b2d985d0ce39,MSFT,Yahoo,Meta Platforms stock is trading tightly in a buy zone. Microsoft stock is also sitting in a buy range as the AI stock eased from a high.,https://finnhub.io/api/news?id=65a9afa28549411421c81ad8fb6a9237100c4e52de5d73216ef1b618a094b4d1,0.0,-0.009285714285714286
company,1709054276,UPDATE 1-OpenAI says New York Times 'hacked' ChatGPT to build copyright lawsuit,126170993,https://s.yimg.com/cv/apiv2/social/images/yahoo_default_logo-1200x1200.png,MSFT,Yahoo,"OpenAI has asked a federal judge to dismiss parts of the New York Times' copyright lawsuit against it, arguing that the newspaper ""hacked"" its chatbot ChatGPT and other artificial-intelligence systems to generate misleading evidence for the case.  So far, judges have dismissed some infringement claims over the output of generative AI systems based on a lack of evidence that AI-created content resembles copyrighted works.",https://finnhub.io/api/news?id=136342e2e9f6c6bbd09f54f35ec99d5fd0803586279324881c8c541d696d2116,0.13636363636363635,0.03712121212121212
company,1709051609,These three Magnificent Seven stocks are earnings winners,126168833,https://s.yimg.com/ny/api/res/1.2/DIl0if6EQe4suuylRGciuA--/YXBwaWQ9aGlnaGxhbmRlcjt3PTEyMDA7aD02NzY-/https://s.yimg.com/os/creatr-uploaded-images/2024-02/df91b920-d585-11ee-97d5-659c857b1604,MSFT,Yahoo,"The top tech stocks, known as the Magnificent Seven - Amazon (AMZN), Apple (AAPL), Alphabet (GOOG,GOOGL), NVIDIA (NVDA), Meta (META), Microsoft (MSFT), and Tesla (TSLA) have all reported their latest quarterly results. Following the reports, analysts revised their earnings estimates for upcoming quarters. Yahoo Finance Markets Reporter Josh Schafer explains how the Wall Street's views on the Magnificent Seven may be evolving. For more expert insight and the latest market action, click here to watch this full episode of Yahoo Finance Live. Editor's note: This article was written by Nicholas Jacobino",https://finnhub.io/api/news?id=98023cbf402629b4a5d1a363494662d52e37f4d8c0e59d209d790e3a7581abcc,1.0,0.4586363636363636
company,1709051520,Microsoft Corp. stock underperforms Tuesday when compared to competitors,126174877,https://images.mktw.net/im-220105/social,MSFT,MarketWatch,"Shares of Microsoft Corp. slipped 0.01% to $407.48 Tuesday, on what proved to be an all-around mixed trading session for the stock market, with the S&P 500...",https://finnhub.io/api/news?id=8b67598026ec37194c1cd2662a5e022e832ead7b496019c0135bca1f2da43799,0.0,0.1
